Source,Author,Title,Description,URL,Published At,Content
Engadget,Jon Fingas,Netflix starts charging for account sharing in the US,Netflix has been quick to act on its plans to charge for account sharing in the US. The streaming service is notifying American customers that they'll need to pay $8 per month for viewers outside of the household who want to share the account. As in other cou…,https://www.engadget.com/netflix-starts-charging-for-account-sharing-in-the-us-185133792.html,2023-05-23T18:51:33Z,Netflix has been quick to act on its plans to charge for account sharing in the US. The streaming service is notifying American customers that they'll need to pay $8 per month for viewers outside of … [+1566 chars]
Engadget,Steve Dent,Netflix makes it easier to find titles you've added to your list but haven't watched yet,"Netflix's latest updates to its mobile app make it easier to search through bookmarked content in the ""My List"" feature, TechCrunch has reported. New filters let you sort titles by movie, series, release date, alphabetical order, and date added.The most inter…",https://www.engadget.com/netflix-makes-it-easier-to-find-titles-youve-added-to-your-list-but-havent-watched-yet-104554461.html,2023-05-23T10:45:54Z,"Netflix's latest updates to its mobile app make it easier to search through bookmarked content in the ""My List"" feature, TechCrunch has reported. New filters let you sort titles by movie, series, rel… [+1057 chars]"
The Verge,Jay Peters,Netflix is making it easier to find saved shows and movies you still haven’t watched,Netflix is making improvements to its My List feature so that you can more easily sort through the shows and movies you’ve bookmarked. Netflix is also adding a “Coming Soon” row to the homescreen on the TV version of its app.,https://www.theverge.com/2023/5/22/23733117/netflix-my-list-saved-shows-movies-filter-sort-coming-soon,2023-05-22T18:16:14Z,"Netflix is making it easier to find saved shows and movies you still havent watched
Netflix is making it easier to find saved shows and movies you still havent watched
 / New filtering options in M… [+1600 chars]"
The Verge,Andrew Webster,Netflix is launching its Queen’s Gambit chess game in July,"Netflix is releasing a number of iPhone and Android games for subscribers this summer, including The Queen’s Gambit Chess, Oxenfree 2, and a new Cut the Rope.",https://www.theverge.com/2023/6/6/23749347/netflix-queens-gambit-chess-game-release-date,2023-06-06T19:00:00Z,"Netflix is launching its Queens Gambit chess game in July
Netflix is launching its Queens Gambit chess game in July
 / The new title headlines the services lineup of mobile games for the summer.
B… [+1772 chars]"
The Verge,Emma Roth,"In a shocking turn of events, Netflix subscriptions rise after password-sharing crackdown","Netflix is already seeing an increase in subscribers after announcing its password-sharing crackdown in the US, according to data from Antenna.",https://www.theverge.com/2023/6/9/23755156/netflix-subscriber-increase-paid-password-sharing-crackdown,2023-06-09T13:54:22Z,"In a shocking turn of events, Netflix subscriptions rise after password-sharing crackdown
In a shocking turn of events, Netflix subscriptions rise after password-sharing crackdown
 / Netflix saw a … [+2089 chars]"
The Verge,Charles Pulliam-Moore,"One Piece, 3 Body Problem, and The Last Airbender are all coming to Netflix’s Tudum","Netflix’s Tudum is coming to São Paulo, Brazil, on June 17th, and the livestreamed event will debut all-new looks at Avatar: The Last Airbender, 3 Body Problem, and more.",https://www.theverge.com/23745319/netflic-tudum-2023-brazil-trailer,2023-06-01T15:35:19Z,"Every year, Netflix fires up the Tudum hype machine in hopes of working fans into trailer-fueled frenzies that turn them into walking, talking spokespeople for the streaming platform. The trailer for… [+659 chars]"
Gizmodo.com,Rob Bricken,Zack Snyder's Rebel Moon Might Be More Star Wars Than He Realizes,"In the early 2010s, not long after Man of Steel, director Zack Snyder met with Lucasfilm to pitch a stand-alone Star Wars movie to be directed by him. The partnership didn’t work out, but a decade later, Netflix embraced the idea with open arms, a sizable bud…",https://gizmodo.com/zack-snyder-rebel-moon-star-wars-netflix-sci-fi-1850510196,2023-06-06T17:15:00Z,"In the early 2010s, not long after Man of Steel, director Zack Snyder met with Lucasfilm to pitch a stand-alone Star Wars movie to be directed by him. The partnership didnt work out, but a decade lat… [+4537 chars]"
Gizmodo.com,Kyle Barr,"From Disney+ to Max, Here Are the Best Streaming Services","There was a time when you could hop onto Netflix and feel like you had pretty much any movie or show at your fingertips. Those years are long gone. Now consumers have a growing number of streaming providers all clamoring for attention, splitting up the media …",https://gizmodo.com/best-streaming-service-disney-hbo-max-paramount-hulu-es-1850303611,2023-05-25T20:00:00Z,There was a time when you could hop onto Netflix and feel like you had pretty much any movie or show at your fingertips. Those years are long gone. Now consumers have a growing number of streaming pr… [+21126 chars]
Engadget,Peter Cao,Disney+ and Hulu will remove a slew of titles on May 26th,"Disney+ and Hulu are starting to purge a number of shows from their respective streaming services. This seems to be an industry-wide trend that reinforces the idea that you don’t own anything with subscriptions.As reported by Deadline
, a slew of titles on D…",https://www.engadget.com/disney-and-hulu-will-remove-a-slew-of-titles-on-may-26th-204658321.html,2023-05-19T20:46:58Z,Disney+ and Hulu are starting to purge a number of shows from their respective streaming services. This seems to be an industry-wide trend that reinforces the idea that you dont own anything with sub… [+1230 chars]
Engadget,Sarah Fielding,Amazon's Echo Show 8 is 42 percent off right now,"There are so many good smart displays out there that it can be hard to choose which one to buy. Right now, one of our favorites, Amazon's second-generation Echo Show 8, is running down to $75 from $130 — a 42 percent discount and just $5 off its lowest price.…",https://www.engadget.com/amazons-echo-show-8-is-42-percent-off-right-now-115033702.html,2023-06-09T11:50:33Z,"There are so many good smart displays out there that it can be hard to choose which one to buy. Right now, one of our favorites, Amazon's second-generation Echo Show 8, is running down to $75 from $1… [+947 chars]"
Google News,,Netflix updates policy on user account sharing - Reuters,Netflix updates policy on user account sharing  Reuters,https://consent.google.com/ml?continue=https://news.google.com/rss/articles/CBMiZmh0dHBzOi8vd3d3LnJldXRlcnMuY29tL2J1c2luZXNzL21lZGlhLXRlbGVjb20vbmV0ZmxpeC11cGRhdGVzLXBvbGljeS11c2VyLWFjY291bnQtc2hhcmluZy0yMDIzLTA1LTIzL9IBAA?oc%3D5&gl=FR&hl=en-US&cm=2&pc=n&src=1,2023-05-23T18:29:00Z,"We use cookies and data to<ul><li>Deliver and maintain Google services</li><li>Track outages and protect against spam, fraud, and abuse</li><li>Measure audience engagement and site statistics to unde… [+1131 chars]"
Google News,,Netflix shareholders withhold support for executive pay package - Reuters,Netflix shareholders withhold support for executive pay package  Reuters,https://consent.google.com/ml?continue=https://news.google.com/rss/articles/CBMiamh0dHBzOi8vd3d3LnJldXRlcnMuY29tL3RlY2hub2xvZ3kvbmV0ZmxpeC1zaGFyZWhvbGRlcnMtd2l0aGhvbGQtc3VwcG9ydC1leGVjdXRpdmUtcGF5LXBhY2thZ2UtMjAyMy0wNi0wMi_SAQA?oc%3D5&gl=FR&hl=en-US&cm=2&pc=n&src=1,2023-06-02T02:00:32Z,"We use cookies and data to<ul><li>Deliver and maintain Google services</li><li>Track outages and protect against spam, fraud, and abuse</li><li>Measure audience engagement and site statistics to unde… [+1131 chars]"
Wired,Lily Hay Newman,Netflix’s Password-Sharing Crackdown Has Hit the US,"TikTok user data is exposed to Chinese ByteDance employees, a screen recording app goes rogue in Google Play, and privacy groups want Slack to expand encryption.",https://www.wired.com/story/netflix-password-sharing/,2023-05-27T13:00:00Z,"Officials in Spain want to ban end-to-end encryption in the European Union, according to a leaked government document obtained by WIRED. The stance emerged as part of a survey of EU member states rel… [+3440 chars]"
Google News,,"Netflix, Amazon, Disney-backed group protests India's tobacco rules ... - Reuters India","Netflix, Amazon, Disney-backed group protests India's tobacco rules ...  Reuters India",https://consent.google.com/ml?continue=https://news.google.com/rss/articles/CBMid2h0dHBzOi8vd3d3LnJldXRlcnMuY29tL3dvcmxkL2luZGlhL25ldGZsaXgtYW1hem9uLWRpc25leS1iYWNrZWQtZ3JvdXAtcHJvdGVzdHMtaW5kaWFzLXRvYmFjY28tcnVsZXMtbGV0dGVyLTIwMjMtMDYtMDkv0gEA?oc%3D5&gl=FR&hl=en-US&cm=2&pc=n&src=1,2023-06-09T16:42:00Z,"We use cookies and data to<ul><li>Deliver and maintain Google services</li><li>Track outages and protect against spam, fraud, and abuse</li><li>Measure audience engagement and site statistics to unde… [+1131 chars]"
Google News,,Netflix says ad tier now has nearly 5 million monthly active users - Reuters,Netflix says ad tier now has nearly 5 million monthly active users  Reuters,https://consent.google.com/ml?continue=https://news.google.com/rss/articles/CBMicWh0dHBzOi8vd3d3LnJldXRlcnMuY29tL3RlY2hub2xvZ3kvbmV0ZmxpeC1zYXlzLWFkLXRpZXItbm93LWhhcy1uZWFybHktNS1taWxsaW9uLW1vbnRobHktYWN0aXZlLXVzZXJzLTIwMjMtMDUtMTcv0gEA?oc%3D5&gl=FR&hl=en-US&cm=2&pc=n&src=1,2023-05-17T21:44:00Z,"We use cookies and data to<ul><li>Deliver and maintain Google services</li><li>Track outages and protect against spam, fraud, and abuse</li><li>Measure audience engagement and site statistics to unde… [+1131 chars]"
Google News,,Netflix co-CEO Ted Sarandos to visit S.Korea this month - Yonhap - Reuters,Netflix co-CEO Ted Sarandos to visit S.Korea this month - Yonhap  Reuters,https://consent.google.com/ml?continue=https://news.google.com/rss/articles/CBMia2h0dHBzOi8vd3d3LnJldXRlcnMuY29tL21hcmtldHMvYXNpYS9uZXRmbGl4LWNvLWNlby10ZWQtc2FyYW5kb3MtdmlzaXQtc2tvcmVhLXRoaXMtbW9udGgteW9uaGFwLTIwMjMtMDYtMDcv0gEA?oc%3D5&gl=FR&hl=en-US&cm=2&pc=n&src=1,2023-06-07T02:33:00Z,"We use cookies and data to<ul><li>Deliver and maintain Google services</li><li>Track outages and protect against spam, fraud, and abuse</li><li>Measure audience engagement and site statistics to unde… [+1131 chars]"
Gizmodo.com,Lauren Leffer,"Obama Crossed the Picket Line, Striking Writers Say","The Writers Guild of America is currently on strike against against the Alliance of Motion Picture and Television Producers. Screenwriters are battling the Hollywood studios for higher pay, better working conditions, and contract protections from AI replaceme…",https://gizmodo.com/writers-strike-netflix-obama-wga-west-1850479625,2023-05-26T19:07:00Z,"The Writers Guild of America is currently on strike against against the Alliance of Motion Picture and Television Producers. Screenwriters are battling the Hollywood studios for higher pay, better wo… [+4371 chars]"
Engadget,Peter Cao,Amazon is reportedly planning an ad-supported tier for Prime Video,"Amazon is reportedly planning to introduce an ad-supported tier to its Prime Video platform. The Wall Street Journal
 reports that discussions are in the early stages and have been going on for the past several weeks.The report goes on to say that advertiser…",https://www.engadget.com/amazon-is-reportedly-planning-an-ad-supported-tier-for-prime-video-201032287.html,2023-06-07T20:10:32Z,"Amazon is reportedly planning to introduce an ad-supported tier to its Prime Video platform. The Wall Street Journal
 reports that discussions are in the early stages and have been going on for the … [+1758 chars]"
Engadget,Lawrence Bonk,Usagi Yojimbo will be playable in the upcoming DLC for 'TMNT: Shredder's Revenge',"Developer Tribute Games and publisher Dotemu just announced some robust DLC coming later this year
 for the well-reviewed beat 'em up
Teenage Mutant Ninja Turtles: Shredder’s Revenge. The Dimension Shellshock DLC features a new game mode, new color swaps fo…",https://www.engadget.com/usagi-yojimbo-will-be-playable-in-the-upcoming-dlc-for-tmnt-shredders-revenge-183946343.html,2023-06-07T18:39:46Z,"Developer Tribute Games and publisher Dotemu just announced some robust DLC coming later this year
 for the well-reviewed beat 'em up
Teenage Mutant Ninja Turtles: Shredders Revenge. The Dimension … [+1600 chars]"
Engadget,Nathan Ingraham,Amazon is reportedly trying to offer Prime subscribers free cell phone service,"Amazon might be planning to offer Prime subscribers a pretty significant perk: free cell phone service. According to Bloomberg, the company is talking with multiple US-based carriers about offering cheap — around $10 a month — or even free phone service to Pr…",https://www.engadget.com/amazon-is-reportedly-trying-to-offer-prime-subscribers-free-cell-phone-service-140026387.html,2023-06-04T12:00:26Z,"Amazon might be planning to offer Prime subscribers a pretty significant perk: free cell phone service. According to Bloomberg, the company is talking with multiple US-based carriers about offering c… [+1488 chars]"
Android Central,tips@androidcentral.com (Nickolas Diaz),Amazon Prime Video throws shade at Netflix for new password-sharing guidelines,Amazon Prime U.K. drudges up something Netflix wishes it could take back.,https://www.androidcentral.com/streaming-tv/amazon-prime-disses-netflix-password-sharing-guidelines,2023-05-26T18:13:50Z,"<ul><li>Amazon Prime U.K. disses Netflix over its once claim that ""love is sharing a password.""</li><li>Netflix has been rolling out its new plan to crack down on users sharing passwords with others … [+2542 chars]"
MacRumors,Juli Clover,"Netflix Password Sharing Crackdown Works, U.S. Subscriber Numbers Soar","Netflix in May started cracking down on password sharing in the United States, and the decision has worked in the company's favor, according to subscriber data shared today by analytics company Antenna (via The Wall Street Journal).





Just after putting an…",https://www.macrumors.com/2023/06/09/netflix-password-crackdown-subscriber-increase/,2023-06-09T22:52:00Z,"Netflix in May started cracking down on password sharing in the United States, and the decision has worked in the company's favor, according to subscriber data shared today by analytics company Anten… [+2765 chars]"
The Guardian,Mark Sweney,Netflix warns UK broadband firms of crackdown on password sharing,"Streaming service tells Sky, Virgin Media and BT they may face backlash from customersNetflix has warned telecoms companies including Sky, Virgin Media and BT to brace for a potential backlash from customers who view its films and TV shows through their servi…",https://www.theguardian.com/media/2023/may/16/netflix-uk-broadband-firms-crackdown-password-sharing-sky-virgin-media-bt,2023-05-16T14:18:48Z,"Netflix has warned telecoms companies including Sky, Virgin Media and BT to brace for a potential backlash from customers who view its films and TV shows through their services, as the streaming serv… [+8199 chars]"
The Guardian,Mark Sweney Media business editor,Netflix crackdown on password sharing reaches the UK,Streaming company tells its 15 million subscribers in Britain that the service can no longer be used free by other householdsNetflix has begun its crackdown on the millions of UK subscribers who share their passwords with friends and family.The streaming comp…,https://www.theguardian.com/media/2023/may/23/netflix-crackdown-on-password-sharing-reaches-the-uk,2023-05-23T19:11:45Z,"Netflix has begun its crackdown on the millions of UK subscribers who share their passwords with friends and family.
The streaming company has sent a letter to its British users, many of whom share … [+2008 chars]"
Android Central,derrek.lee@futurenet.com (Derrek Lee),Netflix update makes it easier to find the content you haven't watched yet (but want to),Netflix is updating its mobile and TV apps with new ways to find both existing and upcoming content.,https://www.androidcentral.com/streaming-tv/netflix-my-list-filters-coming-soon-row,2023-05-22T21:03:43Z,"<ul><li>Netflix is updating the ""My List"" feature on mobile devices.</li><li>Users will be able to filter through content in their list they have yet to watch.</li><li>The feature is not yet coming t… [+1730 chars]"
CNET,Nina Raemont,"Netflix Planning Its First Live Sports Event, Report Says - CNET","The celebrity tournament would be set in Las Vegas, according to The Wall Street Journal.",https://www.cnet.com/tech/home-entertainment/netflix-planning-its-first-live-sports-event-report-says/,2023-06-13T16:56:00Z,"Netflix could be entering its livestreamed-sports era with a celebrity golf tournament, according to a report. The company is in talks to launch a tournament this fall that would feature professional… [+1103 chars]"
Slashdot.org,msmash,Netflix Alerts Telecoms Groups Over Looming Account-Sharing Crackdown,"Netflix has held talks with UK telecoms groups that carry the streaming group's service ahead of a crackdown on account sharing expected later this month. From a report: The US group, which has said the free use of its platform has hit its ability to invest i…",https://entertainment.slashdot.org/story/23/05/17/1943259/netflix-alerts-telecoms-groups-over-looming-account-sharing-crackdown,2023-05-17T20:01:00Z,The Fine Print: The following comments are owned by whoever posted them. We are not responsible for them in any way.
Android Central,derrek.lee@futurenet.com (Derrek Lee),Netflix's controversial password-sharing crackdown hits the US,Netflix is warning U.S. subscribers that they may be charged for extra members on their accounts that aren't in their household.,https://www.androidcentral.com/streaming-tv/netflix-account-sharing-changes-us,2023-05-23T22:37:13Z,<ul><li>Netflix has begun cracking down on password sharing in the United States.</li><li>The company will notify account holders that are sharing their accounts with users outside their households.<… [+2911 chars]
CNET,Corinne Reichert,"Netflix Password Sharing Crackdown Sees Over 200,000 New Subscribers Sign Up - CNET","If someone's just booted you off their Netflix account, maybe you're one of the many new signups for the streaming giant.",https://www.cnet.com/tech/services-and-software/netflix-password-sharing-crackdown-sees-over-200000-new-subscribers-sign-up/,2023-06-13T22:48:00Z,"Netflix has raked in hundreds of thousands of new account signups since it started charging people extra if they have other users on their account. 
That's according to stats from streaming data ana… [+2268 chars]"
VentureBeat,Mike Minotti,Former Netflix exec starts Midwest game publisher,Ben Kvalo has left Netflix and his position there as lead project manager of games to start a new publisher based in the Midwest.,https://venturebeat.com/games/former-netflix-exec-starts-midwest-game-company/,2023-05-23T16:00:00Z,"Connect with top gaming leaders in Los Angeles at GamesBeat Summit 2023 this May 22-23. Register here.
Ben Kvalo has left Netflix and his position there as lead project manager of games to start a n… [+1227 chars]"
Business Insider,George Glover,"Netflix's password-sharing crackdown could fuel a $20 billion valuation surge, Bank of America says","Netflix shares could climb 12% if the streaming giant's password-sharing crackdown proves a success, according to Bank of America.",https://markets.businessinsider.com/news/stocks/netflix-stock-market-analysis-password-sharing-crackdown-bank-of-america-2023-6,2023-06-14T09:00:08Z,"Netflix shares could surge 12% if the streaming giant's password-sharing crackdown proves a success, according to Bank of America.Charley Gallay/Getty Images for Netflix
<ul>
<li>Netflix shares coul… [+2307 chars]"
Business Insider,Matthew Fox,"Netflix stock could surge 17% as it sees early success in its low-cost ad tier and paid sharing rollout, JPMorgan says","""We believe there is further upside as Netflix executes on paid sharing and estimates move higher,"" JPMorgan said.",https://markets.businessinsider.com/news/stocks/netflix-stock-price-outlook-paid-sharing-advertising-subscription-success-jpmorgan-2023-6,2023-06-08T16:59:55Z,"Netflix will introduce its paid-sharing account before the end of March.Jakub Porzycki/NurPhoto via Getty Images
<ul><li>Netflix stock has more upside as it sees early success in its low-cost ad tie… [+2734 chars]"
CNET,Kourtnee Jackson,June Is Busy for Streaming Services. Let's Help You Decide Which Ones to Keep - CNET,"Avatar swoops in, and you may not want to cancel Netflix if you're a fan of Henry Cavill in The Witcher.",https://www.cnet.com/tech/services-and-software/june-is-busy-for-streaming-services-lets-help-you-decide-which-ones-to-keep/,2023-06-01T11:15:03Z,"If there's one month during the summer you want to have the big three streaming services -- Netflix, Max and Disney Plus -- on your roster, it's June. But that doesn't mean you shouldn't still consid… [+6595 chars]"
Business Insider,Huileng Tan,"Arnold Schwarzenegger got a buzzy new job with no real function at Netflix, and he bulldozed a Mercedes Benz with his own tank to announce it","The action superstar said he's working ""round the clock"" to bring Netflix audiences the ""biggest action on earth.""",https://www.businessinsider.com/netflix-action-arnold-schwarzenegger-new-job-chief-officer-2023-5,2023-05-23T08:27:56Z,"Arnold Schwarzenegger is Netflix's new Chief Action Officer.Geoffroy Van der Hasselt/NurPhoto/Getty Images
<ul>
<li>Arnold Schwarzenegger, 75, just took on a brand new job as Netflix's Chief Action … [+2767 chars]"
The Guardian,Jim Waterson,Drive to Survive commentator sacked from Formula E over ‘inappropriate behaviour’,"Jack Nicholls, who provides F1 coverage for Netflix and BBC, lost his job working for electric Formula E seriesA commentator on the hit Netflix show Formula 1: Drive to Survive has been sacked from his job with a rival racing championship after complaints of …",https://www.theguardian.com/sport/2023/may/31/motor-racing-commentator-sacked-after-complaints-of-inappropriate-behaviour,2023-05-31T19:39:34Z,"A commentator on the hit Netflix show Formula 1: Drive to Survive has been sacked from his job with a rival racing championship after complaints of inappropriate behaviour towards women.
Jack Nichol… [+2409 chars]"
Slashdot.org,msmash,Netflix's Password Sharing Crackdown Officially Hits US Customers,"Netflix's controversial password sharing crackdown just hit the US. From a report: In addition to the US, Netflix confirmed it will also be rolling out the crackdown across all regions around the world such as the UK, France, Germany, Mexico, Brazil, Singapor…",https://entertainment.slashdot.org/story/23/05/23/199219/netflixs-password-sharing-crackdown-officially-hits-us-customers,2023-05-23T19:09:00Z,"I've been under the crackdown for five months, or so I'm told. Two households of occasional viewers, same city, but a long way apart. Not a peep. Put a pin in the indignation and wait to see if they … [+44 chars]"
Business Insider,Jordan Hart,Netflix users slam streamer for password-sharing ban: 'I've literally never cancelled a membership so fast',Netflix subscribers are once again calling out the streaming platform for charging an extra $8 to add watchers to their accounts.,https://www.businessinsider.com/netflix-users-slam-streamer-cancel-memberships-over-password-sharing-ban-2023-5,2023-05-27T15:32:58Z,"The new Netflix policy will charge members for streaming outside of their households.Courtesy of Netflix
<ul>
<li>Netflix's password crackdown is still not landing well with some subscribers.</li>
<… [+2143 chars]"
Business Insider,Insider Inc.,Netflix is going to charge $8 to add someone to your account,Netflix subscribers in the US on standard or premium plans will be able to share a password with someone living outside their home for an extra $8.,https://www.businessinsider.com/netflix-charging-8-to-add-another-user-to-your-account-2023-5,2023-05-23T19:01:26Z,"Netflix subscribers on its standard or premium plans will be able to share their password with someone living outside their household for an extra $8.Jakub Porzycki/NurPhoto via Getty Images

<ul>
<… [+1924 chars]"
Business Insider,Ashley Rodriguez,Netflix investors voted against rich pay packages for the company's top execs amid the ongoing Hollywood writers' strike,"WGA West's president wrote to Netflix investors ahead of the vote, which is non-binding, saying the executive pay plan was ""egregious against the backdrop of the strike.""",https://www.businessinsider.com/netflix-shareholders-vote-against-executive-pay-amid-hollywood-writers-strike-2023-6,2023-06-02T22:48:17Z,"Ted Sarandos.Getty
<ul>
<li>Netflix shareholders on Thursday voted against pay packages for top execs totaling up to $109 million.</li>
<li>The vote is non-binding and could be overruled when the bo… [+2031 chars]"
Business Insider,Nathan McAlone,"Sorry, but Netflix's password-sharing crackdown seems to be going really well so far","Netflix has had four of the largest US customer acquisition days in over four years since its password crackdown began, per data from Antenna.",https://www.businessinsider.com/netflix-password-sharing-crackdown-success-drives-account-sign-ups-data-2023-6,2023-06-09T13:59:41Z,"Netflix's ""Beef.""Andrew Cooper/Netflix
<ul>
<li>Netflix's password-sharing crackdown has had a solid start in the US, according to new data.</li>
<li>Netflix has had four of its largest US customer … [+2875 chars]"
