Source,Author,Title,Description,URL,Published At,Content
CNET,Zachary McAuliffe,Almost 5 Million People Are Using Netflix's New Plan With Ads - CNET,The ad-supported tier launched in November 2022.,https://www.cnet.com/tech/services-and-software/almost-5-million-people-are-using-netflixs-new-plan-with-ads/,2023-05-18T16:25:18Z,"Netflix announced Wednesday at it's 2023 Upfront presentation that almost 5 million people are using the service's ad-supported tier plan, called Standard with ads (formerly it was Basic with ads). N… [+2092 chars]"
CNET,Kourtnee Jackson,Netflix Is Making It Easier for You to Keep Up With New Releases - CNET,Your TV screen will help you quickly track what's streaming next.,https://www.cnet.com/tech/services-and-software/netflix-making-it-easier-for-you-to-keep-up-with-new-releases/,2023-06-05T17:21:53Z,Netflix has begun rolling out a new update this week for its TV app to help you keep up with the streaming service's latest releases. A Coming Soon row is being added to the home screen to let viewer… [+1497 chars]
Android Central,jeramy.johnson@futurenet.com (Jeramy Johnson),AC Podcast 605: Netflix's Password-Sharing Crackdown Hits The US,"On this week&apos;s episode of the Android Central Podcast, Shruti Shekar, Jerry Hildenbrand, Andrew Myrick, and Derrek Lee discuss Netflix cracking down on password-sharing Microsoft Copilot, the pro",https://www.androidcentral.com/phones/ac-podcast-605-netflixs-password-sharing-crackdown-hits-the-us,2023-05-30T17:40:47Z,"Android Central is part of Future US Inc, an international media group and leading digital publisher. Visit our corporate site.
©
Future US, Inc. Full 7th Floor, 130 West 42nd Street,
New York,
N… [+7 chars]"
Business Insider,Ashley Rodriguez,"Netflix reportedly is plotting its first live sports event, a celebrity golf tournament that could redeem the streamer after its 'Love Is Blind' livestreaming debacle","With reported plans for a live celebrity golf event tied to its docuseries ""Full Swing"" and ""Drive to Survive,"" Netflix could redeem itself after its failed ""Love Is Blind"" livestream.",https://www.businessinsider.com/netflix-exploring-live-sports-after-love-is-blind-reunion-debacle-2023-6,2023-06-13T19:13:48Z,"Sahith Theegala in Netflix's ""Full Swing.""Netflix
<ul>
<li>Netflix may be ready to get into live sports after its ""Love Is Blind"" reunion livestreaming snafu.</li>
<li>The streamer is planning a liv… [+2952 chars]"
CNET,Kourtnee Jackson,Netflix Password-Sharing Is No Longer Free in the US - CNET,A policy change now means an extra charge if you want to share a password on a standard or premium account.,https://www.cnet.com/tech/services-and-software/netflix-password-sharing-is-no-longer-free-in-the-us/,2023-05-24T14:33:24Z,Netflix said Tuesday it's now rolling out its updated policy on account-sharing in the US. It will begin sending emails on May 23 to customers who are sharing passwords with anyone outside of their h… [+2698 chars]
The Verge,Jay Peters,The Witcher is officially one of the most successful game series of all time,"CD Projekt Red revealed Monday that its The Witcher series of video games have sold more than 75 million copies, with The Witcher 3: Wild Hunt responsible for more than 50 million of those sales.",https://www.theverge.com/2023/5/29/23741471/the-witcher-cd-projekt-red-cdpr-gaming-franchises,2023-05-29T18:57:19Z,"The Witcher is officially one of the most successful game series of all time
The Witcher is officially one of the most successful game series of all time
 / The series has sold more than 75 million… [+2059 chars]"
The Guardian,Guardian TV,Bafta TV awards 2023: the full list of winners,"Who will take home the biggest prizes in British TV tonight? Here are all the winners, as they are announced Daisy May Cooper – Am I Being Unreasonable? (BBC One)Diane Morgan – Cunk on Earth (BBC Two)Lucy Beaumont – Meet the Richardsons (Dave)Natasia Demetrio…",https://www.theguardian.com/tv-and-radio/2023/may/14/bafta-tv-awards-2023-the-full-list-of-winners,2023-05-14T16:37:20Z,"Female performance in a comedy programme
Daisy May Cooper Am I Being Unreasonable? (BBC One)Diane Morgan Cunk on Earth (BBC Two)Lucy Beaumont Meet the Richardsons (Dave)Natasia Demetriou Ellie &amp;… [+5416 chars]"
Boing Boing,Devin Nealy,Netflix drops the first trailer for Skull Island,"Get ready to return to King Kong's homeland with the first trailer for Netflix's Skull Island. 











Who would've thought the King Kong franchise would have this much juice left in its system? Sure, on one level, were still in the intellectual property …",https://boingboing.net/2023/05/24/netflix-drops-the-first-trailer-for-skull-island.html,2023-05-24T16:15:48Z,"Get ready to return to King Kong's homeland with the first trailer for Netflix's Skull Island. 
Who would've thought the King Kong franchise would have this much juice left in its system? Sure, on o… [+696 chars]"
The Guardian,Emma Brockes,Digested week: Netflix bans password-sharing – but I’m close to bailing anyway | Emma Brockes,"Plus, reflections on Martin Amis’s later years, and Jude Law’s disgusting new cologneThe death of Martin Amis at the weekend triggers a slew of coverage more affectionate than can be imagined for that of many other writers. In America, the obituaries are sobe…",https://www.theguardian.com/uk-news/2023/may/26/digested-week-netflix-bans-password-sharing-but-im-close-to-bailing-anyway,2023-05-26T10:15:14Z,"Monday
The death of Martin Amis at the weekend triggers a slew of coverage more affectionate than can be imagined for that of many other writers. In America, the obituaries are sober, respectful. In… [+5886 chars]"
Lifehacker.com,Brianne Hogan,Seven Creative Date Ideas for Under $50 Each,"Dates can already be stressful, but throw in the curveball of their costs, and, well, they can feel more anxiety-inducing than they’re worth. It’s normal to want to “wow” your date with a solid first impression, but the good news is that they don’t need be su…",https://lifehacker.com/seven-creative-date-ideas-for-under-50-each-1850512775,2023-06-07T15:30:00Z,"Dates can already be stressful, but throw in the curveball of their costs, and, well, they can feel more anxiety-inducing than theyre worth. Its normal to want to wow your date with a solid first imp… [+3505 chars]"
Hipertextual,Luis Miranda,‘The Witcher’ confirma su quinta temporada en Netflix,"The Witcher tiene vida más allá de Henry Cavill. La serie de Netflix, basada en los libros de Andrzej Sapkowski, tendrá una quinta temporada. La confirmación llega por medio de su directora de casting, Sophie Holland, quien reveló en una entrevista sus planes…",http://hipertextual.com/2023/05/the-witcher-confirma-quinta-temporada-netflix,2023-05-26T21:59:00Z,"The Witchertiene vida más allá de Henry Cavill. La serie de Netflix, basada en los libros de Andrzej Sapkowski, tendrá una quinta temporada. La confirmación llega por medio de su directora de casting… [+3202 chars]"
Hipertextual,Ebenizer Pinedo,Netflix pone fin a las cuentas compartidas en México,"Durante los últimos meses, Netflix ha puesto en marcha una estrategia que contempla finalizar, de una vez por todas, las cuentas compartidas. Sin embargo, ciertos países todavía se mantenían fuera de los cambios en su política. Hoy, para desgracia de muchísim…",http://hipertextual.com/2023/05/netflix-prohibe-cuentas-compartidas-mexico,2023-05-23T19:24:48Z,"Durante los últimos meses, Netflix ha puesto en marcha una estrategia que contempla finalizar, de una vez por todas, las cuentas compartidas. Sin embargo, ciertos países todavía se mantenían fuera de… [+3326 chars]"
Hipertextual,Nolan Rada Galindo,"Netflix confirmó la fecha, hora y lugar del Tudum 2023","Netflix se celebra a sí mismo en un evento enorme. Para ellos, ya confirmó la fecha, la hora y el lugar en el que se desarrollará la próxima edición de Tudum, ese mega encuentro en el que se reúnen miles de seguidores que van a ver a cientos de decenas de act…",http://hipertextual.com/2023/06/tudum-2023-netflix-brasil,2023-06-01T18:01:00Z,"Netflix se celebra a sí mismo en un evento enorme. Para ellos, ya confirmó la fecha, la hora y el lugar en el que se desarrollará la próxima edición de Tudum, ese mega encuentro en el que se reúnen m… [+2393 chars]"
Slashdot.org,BeauHD,Netflix Password Crackdown Drives US Sign-Ups To Highest Levels In At Least Four Years,"According to research company Antenna, Netflix's password crackdown in the U.S. has resulted in the ""four single largest days of U.S. user sign-ups since January 2019, when Antenna first began tracking the metric,"" reports Variety. ""On May 23, Netflix began n…",https://entertainment.slashdot.org/story/23/06/09/170236/netflix-password-crackdown-drives-us-sign-ups-to-highest-levels-in-at-least-four-years,2023-06-09T19:19:00Z,"Based on the most current Antenna data available, Netflix average daily sign-ups reached 73,000 from May 25-28, a 102% increase from the prior 60-day average. That was more than the spikes in subscri… [+1001 chars]"
Business Insider,Ashley Rodriguez,'The Mother' starring Jennifer Lopez is one of Netflix's biggest hit movies of all time,"The action film ""The Mother,"" which stars Jennifer Lopez, became one of Netflix's most watched movies ever after just a few weeks on the platform.",https://www.businessinsider.com/jennifer-lopez-the-mother-one-netflix-biggest-movies-ever-2023-6,2023-06-06T20:09:36Z,"Jennifer Lopez in ""The Mother.""Netflix
<ul>
<li>""The Mother,"" starring Jennifer Lopez, is one of Netflix's most watched movies of all time.</li>
<li>The action film cracked the top 10 list during th… [+1712 chars]"
NPR,Terry Gross,Chef Lidia Bastianich looks back on her family's chaotic life in Europe after WWII,The James Beard Award-winning chef fled the Italian peninsula of Istria after it was handed over to Communist Yugoslavia following WWII. Her new Netflix show is Lidia Celebrates America.,https://www.npr.org/2023/05/24/1177882468/chef-lidia-bastianich-looks-back-on-her-familys-chaotic-life-in-europe-after-wwi,2023-05-24T17:28:58Z,The James Beard Award-winning chef fled the Italian peninsula of Istria after it was handed over to Communist Yugoslavia following WWII. Her new Netflix show is Lidia Celebrates America.
Polygon,Pete Volk,"The 7 best movies new to streaming on Netflix, Max, Prime Video, and Hulu (June 2023)","The best movies new to streaming in June 2023, with great movies to watch on Netflix, Max, and more. Watch Terminator 2 and Magic Mike on Netflix this month.",https://www.polygon.com/what-to-watch/2023/6/3/23743761/best-new-movies-netflix-amazon-prime-hbo-max-hulu-june-2023,2023-06-03T13:00:00Z,"If you buy something from a Polygon link, Vox Media may earn a commission. See our ethics statement.Happy June, Polygon readers! Its officially summer, which means were officially in the season of bl… [+8486 chars]"
Business Insider,Filip De Mott,Netflix stock jumps 10% on signs that its new ad-based subscription plan is booming,"The streaming platform indicated that its new ad-tier option has 5 million monthly active users, just six months since its introduction.",https://markets.businessinsider.com/news/stocks/netflix-stock-price-ad-supported-plan-monthly-active-users-subscribers-2023-5,2023-05-18T16:57:08Z,"Netflix will introduce its paid-sharing account before the end of March.Jakub Porzycki/NurPhoto via Getty Images
<ul>
<li>Netflix told advertising executives that its new ad-based plan has 5 million… [+1968 chars]"
Business Insider,Vishal Persaud,Mark Cuban says healthcare has to have more of a 'Netflix model',"Cuban recently appeared on Andreessen Horowitz's life sciences podcast, ""Bio Eats World,"" and talked with general partner Vijay Pande.",https://www.businessinsider.com/mark-cuban-healthcare-industry-netlfix-model-a16z-bio-podcast-2023-6,2023-06-13T14:00:06Z,"Mark Cuban recently appeared on the Andreessen Horowitz podcast ""Bio Eats World"" to talk about healthcare.John Lamparski/Getty Images
<ul>
<li>Mark Cuban recently appeared on the a16z podcast ""Bio E… [+2660 chars]"
Business Insider,Reena Koh,A political drama series on Netflix has sparked a #MeToo wave in Taiwan,The show triggered a wave of sexual harassment allegations that led to a series of high-level resignations that rocked Taiwan's political scene.,https://www.businessinsider.com/taiwanese-netflix-hit-series-sparks-metoo-taiwan-sexual-harassment-2023-6,2023-06-14T07:55:38Z,"""Wave Makers"" is written by Chien Li-ying and Yan Shi-ji, and directed by Lin Chun-yangNetflix
<ul>
<li>The Taiwanese Netflix political drama ""Wave Makers"" has sparked a #MeToo wave in Taiwan.</li>
… [+3482 chars]"
Hipertextual,Víctor Millán,Netflix no está tan mal: por qué será la última plataforma de la que te des de baja,"Las plataformas de streaming no pasan su mejor momento, pero el papel de veterana de Netflix parece estar jugando a su favor.",http://hipertextual.com/2023/06/netflix-crisis,2023-06-14T06:01:00Z,"Tras vivir un auge sin precedentes tras el confinamiento y la época más dura de la pandemia, las plataformas de streaming parecen estar viviendo desde finales de 2022 y especialmente en este 2023 su … [+6205 chars]"
Wired,Jeremy White,"BMW i5 Electric: Price, Range, Release Date","The i5 has at last arrived with a good range, impressive speed, and even in-car gaming to banish charging boredom. But there’s an issue if you’re in the UK.",https://www.wired.com/story/bmw-has-finally-made-its-first-all-electric-5-series/,2023-05-24T12:00:00Z,"An entire decade after the launch of its first full production electric vehicle, the i3, BMW has finally revealed its full electric version of the 5 Series, its second most popular car globally.
Wel… [+3046 chars]"
Gizmodo.com,Justin Carter,Disney Gets Big Write-Off After Pulling Its Streaming Shows,"Last week, Disney removed a little over 100 of its original programming from its streaming services such as Disney+ and Hulu around the world. That cut media, which includes the likes of Willow and Marvel’s Runaways, were axed after Disney gave a heads up abo…",https://gizmodo.com/disney-streaming-cuts-tax-writeoffs-1850502594,2023-06-03T14:30:00Z,"Last week, Disney removed a little over 100 of its original programming from its streaming services such as Disney+ and Hulu around the world. That cut media, which includes the likes of Willow and M… [+1737 chars]"
Boing Boing,Jason Weisberger,"Netflix rolls out its ""crackdown"" on global password sharing","Netflix has determined it is time to start cracking down on the password sharing they pretty much ignored-to-encouraged over the years. Having added some account transfer features, the whole ""everyone should pay us individually because it'd be better for our …",https://boingboing.net/2023/05/24/netflix-rolls-out-its-crackdown-on-global-password-sharing.html,2023-05-24T17:20:47Z,"Netflix has determined it is time to start cracking down on the password sharing they pretty much ignored-to-encouraged over the years. Having added some account transfer features, the whole ""everyon… [+1392 chars]"
Hipertextual,Ebenizer Pinedo,¿Sorpresa? Netflix crece en EE. UU. tras prohibir las cuentas compartidas,"En cuanto Netflix puso en marcha su cruzada contra las cuentas compartidas, la mayoría intuimos que serían muchos los suscriptores que abandonarían la plataforma. De hecho, España es un claro ejemplo en este sentido. No obstante, debido a que los hábitos de c…",http://hipertextual.com/2023/06/netflix-crece-en-ee-uu-tras-prohibir-las-cuentas-compartidas,2023-06-10T17:59:54Z,"En cuanto Netflix puso en marcha su cruzada contra las cuentas compartidas, la mayoría intuimos que serían muchos los suscriptores que abandonarían la plataforma. De hecho, España es un claro ejemplo… [+3368 chars]"
heise online,Markus Will,#TGIQF – Das Netflix-Quiz,Kennen Sie sich mit dem Streaming-Urgestein Netflix aus? Können Sie die Inhalte herunterbeten? Dann testen Sie ihr Wissen in unserem Quiz!,https://www.heise.de/news/TGIQF-Das-Netflix-Quiz-9162897.html,2023-06-02T10:12:00Z,"Wenn das Wetter am Wochenende nicht zum Hinausgehen einlädt, man krank zu Hause bleibt oder die neue Serienstaffel lockt: Am Video-Streaming-Urgestein Netflix kommt man kaum vorbei. Man kann ganze Nä… [+1591 chars]"
Hipertextual,Rubén Chicharro,"‘La isla de las tentaciones’, pero con deepfakes: así es el último reality distópico de Netflix","Qué es real y qué no. Eso es lo que deberán averiguar los concursantes del último reality de Netflix, Falso Amor, que se estrenará en la plataforma el próximo 6 de julio y que se apoyará en la inteligencia artificial, y más concretamente en los deepfakes, par…",http://hipertextual.com/2023/06/netflix-reality-deepfakes,2023-06-13T10:14:06Z,"Qué es real y qué no. Eso es lo que deberán averiguar los concursantes del último reality de Netflix, Falso Amor, que se estrenará en la plataforma el próximo 6 de julio y que se apoyará en la inteli… [+2816 chars]"
Time,Simmone Shah,How Netflix’s Unsolved Mysteries Led to the Rescue of a Girl Missing for 5 Years,"Kayla Unbehaun, 15, was found in Asheville, North Carolina over the weekend after she was recognized from a Netflix true crime show.",https://time.com/6280669/netflix-unsolved-mysteries-missing-girl-found/,2023-05-17T19:03:25Z,"A missing girl was found in Asheville, North Carolina over the weekend after she was recognized from a Netflix true crime show. 
On Saturday, Kayla Unbehaun, 15, was seen at a shop in Asheville by s… [+1644 chars]"
Time,Judy Berman,Barack Obama’s Working Is a Timely Reality Check on the American Dream—Until It Gets to the Bosses,"The former President's Netflix series documents ""what we do all day"" at work but falls apart when it gets to the bosses. Read TIME's review.",https://time.com/6279943/working-review-obama-netflix/,2023-05-17T12:01:33Z,"In 1974, the author and broadcaster Studs Terkel published a best-selling doorstopper with an equally unwieldy title. Working: People Talk About What They Do All Day and How They Feel About What They… [+8457 chars]"
Hipertextual,Aglaia Berlutti,"‘Yo nunca’, crítica: una despedida por todo lo alto a la mejor comedia adolescente de Netflix","Devi (Maitreyi Ramakrishnan) va a Princeton. Al menos, esa es su intención. También lo es perder la virginidad. El personaje logra ambas cosas a lo largo de la cuarta y última temporada de la serie Yo Nunca de Netflix. Pero lo que parecen pasos inevitables en…",http://hipertextual.com/2023/06/yo-nunca-critica-netflix,2023-06-08T19:02:00Z,"Devi (Maitreyi Ramakrishnan) va a Princeton. Al menos, esa es su intención. También lo es perder la virginidad. El personaje logra ambas cosas a lo largo de la cuarta y última temporada de la serie Y… [+5530 chars]"
The Guardian,PA Media,Don’t Look Up director Adam McKay to triple donations to Just Stop Oil,"Hollywood director of climate crisis satire praised protestors for waking up ‘sleeping governments’ and will triple donations over weekendThe Hollywood director of Netflix film Don’t Look Up has pledged to triple donations to Just Stop Oil over the weekend, t…",https://www.theguardian.com/environment/2023/jun/02/dont-look-up-director-adam-mckay-to-triple-donations-to-just-stop-oil,2023-06-02T22:25:37Z,"The Hollywood director of Netflix film Dont Look Up has pledged to triple donations to Just Stop Oil over the weekend, the group has said.
Adam McKay, who made the satire on the climate crisis as we… [+1522 chars]"
Polygon,Pete Volk,"Avatar: The Way of Water, Living on Netflix, Fast X, and every new movie to watch at home this weekend","The best new movies to watch at home this weekend, including Living on Netflix, Avatar: The Way of Water, Fast X, and more on streaming.",https://www.polygon.com/2023/6/9/23749330/new-movies-watch-avatar-2-way-of-water-netflix-living-fast-x-streaming,2023-06-09T22:15:00Z,"Oel ngati kameie, Polygon readers!
Each week, we round up the most notable releases new to streaming and VOD, highlighting the biggest and best new movies for you to watch at home. This week sees th… [+10032 chars]"
Polygon,Petrana Radulovic,Into the Spider-Verse’s greatest legacy is giving American animators freedom to play,"Spider-Man: Into the Spider-Verse opened the door for animators at DreamWorks, Pixar, Netflix, and more to experiment with style and try new things.",https://www.polygon.com/23745774/spider-man-into-the-spider-verse-animation-pixar-netflix-dreamworks,2023-06-05T13:02:00Z,"When Polygon asked Januel Mercado, co-director of Puss in Boots: The Last Wish, about animation that inspired the visual look of his DreamWorks movie, he had an easy answer: Obviously Spider-Verse. T… [+5114 chars]"
Time,Simmone Shah,Netflix Is Cracking Down on Password Sharing in the U.S. Here’s What to Know,The streamer has begun rolling out its new password protocol in the U.S.,https://time.com/6282750/netflix-password-sharing-household-rules/,2023-05-25T20:06:19Z,"Netflix, the streaming company that once tweeted “Love is sharing a password,” has begun cracking down on password sharing in the United States, as it looks to increase revenue in what has become a s… [+3325 chars]"
GMA,Haley Yamada,Netflix announces password sharing crackdown rollout in US,"""A Netflix account is for use by one household,"" the streaming company said in a blog post on Tuesday.",https://goodmorningamerica.com/culture/story/netflix-announces-password-sharing-crackdown-rollout-us-99551562,2023-05-23T22:56:52Z,"Netflix announced Tuesday that it will begin to send emails to members who are sharing their account information outside of their households in the U.S.
""A Netflix account is for use by one househol… [+1236 chars]"
Hipertextual,Eduardo Arcos,Una de las estrellas de ‘Daredevil’ en Netflix asegura que no hay planes para su regreso en ‘Born Again’,Una de las estrellas de la exitosa y aclamada adaptación hecha por Netflix y Marvel de Daredevil asegura que no hay planes para su regreso en Born Again. Esta es la serie que hará de soft reboot del personaje para el Universo Cinematográfico de Marvel. Debora…,http://hipertextual.com/2023/05/una-de-las-estrellas-de-daredevil-en-netflix-asegura-que-no-hay-planes-para-su-regreso-en-born-again,2023-05-29T11:11:11Z,Una de las estrellas de la exitosa y aclamada adaptación hecha por Netflix y Marvel de Daredevil asegura que no hay planes para su regreso en Born Again. Esta es la serie que hará de soft reboot del … [+3646 chars]
The Guardian,Phil Harrison,Changing Ends to Deadloch: the seven best shows to stream this week,"Alan Carr’s breezy sitcom about his childhood is delightfully riddled with double entendres, plus a darkly amusing Aussie crime drama Continue reading...",https://www.theguardian.com/tv-and-radio/2023/may/26/changing-ends-to-deadloch-the-seven-best-shows-to-stream-this-week,2023-05-26T06:00:26Z,"Pick of the week
Changing Ends
Most 80s coming-out stories tend to be riddled with trauma and shadowed by looming tragedy. But Alan Carr was never likely to go down that route in this breezy, doubl… [+9629 chars]"
Xataka.com,Javier Marquez,Netflix reactiva su cruzada contra las cuentas compartidas en estos países de Latinoamérica: ahora sí toca pagar,"Netflix ha anunciado este martes que los suscriptores de Argentina, Colombia y México que deseen compartir sus cuentas con personas que no vivan en su mismo hogar deberán pagar. El gigante de streaming, que había replegado algunas de sus medidas para combatir…",https://www.xataka.com/streaming/netflix-reactiva-su-cruzada-cuentas-compartidas-estos-paises-latinoamerica-ahora-toca-pagar,2023-05-23T19:22:00Z,"Netflix ha anunciado este martes que los suscriptores de Argentina, Colombia y México que deseen compartir sus cuentas con personas que no vivan en su mismo hogar deberán pagar. El gigante de streami… [+3969 chars]"
9to5Mac,Zac Hall,Netflix password sharing crackdown has finally reached the US,"Netflix is breaking up with you. First, it asked for those unreturned DVDs back. Now it expects you to pay for your own Netflix account.
The company’s crackdown on password sharing has been ramping up across the globe for a while now, and starting today, Netf…",https://9to5mac.com/2023/05/23/netflix-password-sharing/,2023-05-23T19:22:55Z,"Netflix is breaking up with you. First, it asked for those unreturned DVDs back. Now it expects you to pay for your own Netflix account.
The companys crackdown on password sharing has been ramping u… [+1424 chars]"
Engadget,Mat Smith,The Morning After: What to expect from Apple’s WWDC 2023,"Apple’s big developer conference kicks off June 5th, and all the signs point to the company’s mixed reality headset making its first appearance. The tech giant has been acquiring headset-friendly startups
 for years, and if the rumors are true, Apple’s stand…",https://www.engadget.com/the-morning-after-what-to-expect-from-apples-wwdc-2023-111535949.html,2023-06-01T11:15:35Z,"Apples big developer conference kicks off June 5th, and all the signs point to the companys mixed reality headset making its first appearance. The tech giant has been acquiring headset-friendly start… [+3804 chars]"
