Source,Author,Title,Description,URL,Published At,Content
Engadget,Jon Fingas,Summer Game Fest 2023: How to watch and what to expect,"E3 is canceled
 this year due to both the pandemic’s effects on development schedules and the success of events elsewhere in the year, like The Game Awards
. As such, expectations are higher than ever for Summer Game Fest
 (SGF). It’s now the biggest mid-y…",https://www.engadget.com/summer-game-fest-2023-how-to-watch-and-what-to-expect-161527893.html,2023-06-07T16:15:27Z,"E3 is canceled
 this year due to both the pandemics effects on development schedules and the success of events elsewhere in the year, like The Game Awards
. As such, expectations are higher than ev… [+4242 chars]"
Android Central,patrick.farmer@futurenet.com (Patrick Farmer),Paramount Plus will be raising its prices on June 27th,"Paramount Plus has merged with Showtime, which means new content and, unfortunately, higher prices.",https://www.androidcentral.com/streaming-tv/paramount-plus-will-be-raising-its-prices-on-june-27th,2023-05-23T23:24:19Z,"<ul><li>Paramount Plus has announced that they will be increasing prices on both of their streaming plans, starting June 27th.</li><li>The ad-supported Essential plan will now cost $5.99 per month (f… [+1772 chars]"
Hipertextual,Ebenizer Pinedo,El nuevo tráiler de la tercera temporada de ‘The Witcher’ prepara el adiós de Henry Cavill,"Netflix aprovechó los reflectores del Summer Game Fest 2023 para liberar un nuevo y espectacular tráiler de la tercera temporada de The Witcher. Debes recordar que esta temporada se dividirá en dos partes, con la primera estrenándose el 29 de junio. La segund…",http://hipertextual.com/2023/06/nuevo-trailer-tercera-temporada-the-witcher,2023-06-08T19:48:48Z,Netflix aprovechó los reflectores del Summer Game Fest 2023 para liberar un nuevo y espectacular tráiler de la tercera temporada de The Witcher. Debes recordar que esta temporada se dividirá en dos p… [+1410 chars]
HuffPost,Caroline Bologna,This Buzzy Reality Show Is The Top Series On Netflix Right Now,A rom-com spinoff and Spanish psychological thriller are also trending on the streaming service.,https://www.huffpost.com/entry/selling-sunset-popular-netflix-shows_l_646ab849e4b056fd46daa8a5,2023-05-22T20:03:37Z,"Selling Sunset is currently the most popular show on Netflix, according to the streaming services public ranking system.
The sixth season of the hit reality show about high-end real estate agents pr… [+1412 chars]"
The Guardian,Arwa Mahdawi,Therapy is great. But have some Americans had too much? | Arwa Mahdawi,"A new lesbian dating show drummed the point home to me: therapy speak is now ubiquitousEvery evening, after we put our toddler to bed, my wife and I sit down to share our learnings for the day and strategise for the future. We talk about how we can help each …",https://www.theguardian.com/commentisfree/2023/jun/14/therapy-is-great-but-have-some-americans-had-too-much,2023-06-14T06:00:07Z,"Every evening, after we put our toddler to bed, my wife and I sit down to share our learnings for the day and strategise for the future. We talk about how we can help each other achieve our full pote… [+2129 chars]"
Boing Boing,Mark Frauenfelder,Here's the trailer for Black Mirror season 6,"Get ready to dive into the sixth season of the groundbreaking anthology series Black Mirror, set to premiere on June 15, 2023. Netflix just dropped a trailer with five episodes that explore the dark side of technology and its impact on society. — Read the rest",https://boingboing.net/2023/05/31/heres-the-trailer-for-black-mirror-season-6.html,2023-05-31T16:45:47Z,"Get ready to dive into the sixth season of the groundbreaking anthology series Black Mirror, set to premiere on June 15, 2023. Netflix just dropped a trailer with five episodes that explore the dark … [+1558 chars]"
Hipertextual,Aglaia Berlutti,"‘FUBAR’, crítica: Schwarzenegger vuelve en plena forma","La serie de Netflix FUBAR, protagonizada por Arnold Schwarzenegger, empieza fuerte. Creada por Nick Santora, celebra el legado de su intérprete principal en el cine de acción. Al mismo tiempo, destaca que su pasado será importante para comprender lo que vendr…",http://hipertextual.com/2023/05/fubar-critica-netflix,2023-05-25T14:45:01Z,"La serie de NetflixFUBAR, protagonizada por Arnold Schwarzenegger, empieza fuerte. Creada por Nick Santora, celebra el legado de su intérprete principal en el cine de acción. Al mismo tiempo, destaca… [+5709 chars]"
Wired,Boone Ashworth,The Reddit App War Is Getting Messy,"Plus: Amazon Prime might roll out an ad-based tier, AI-powered ads land on LinkedIn, and there's even more talk about face computers.",https://www.wired.com/story/the-reddit-app-war-is-getting-messy/,2023-06-10T13:00:00Z,"Big changes are coming to Reddit, and nobody is happy about it. Reddit management is looking to take the company public, which means the money-minded folks behind the scenes are feeling pressure to s… [+3768 chars]"
Gizmodo.com,Rob Bricken,Meet the Would-Be Heroes of Zack Snyder's Rebel Moon,"Photo: Clay Enos/Netflix
Zack Snyder’s two-part movie Rebel Moon has always had a suitably epic cast, but we haven’t known much about the movie other than a group of heroes band together to try to protect the peaceful, agrarian moon colony of Veldt from the …",https://gizmodo.com/rebel-moon-zack-snyder-character-guide-netflix-sci-fi-1850515090,2023-06-07T19:15:00Z,"Zack Snyders two-part movie Rebel Moonhas always had a suitably epic cast, but we havent known much about the movie other than a group of heroes band together to try to protect the peaceful, agrarian… [+305 chars]"
Xataka.com,John Tones,Netflix lleva años estrenando muchas más series de las que podemos consumir. Ahora al fin sabemos por qué,"Se ha dicho en un sinnúmero de ocasiones: Netflix llena su catálogo con estrenos continuos, en una especie de estrategia de saturación que le ha hecho ganarse también sus peores críticas: ¿hay motivos para este ritmo que les lleva a lanzar un puñado de series…",https://www.xataka.com/streaming/netflix-desvela-al-fin-motivo-oculto-estrategia-estrenar-series-parar-superservir-al-publico,2023-05-19T09:01:14Z,"Se ha dicho en un sinnúmero de ocasiones: Netflix llena su catálogo con estrenos continuos, en una especie de estrategia de saturación que le ha hecho ganarse también sus peores críticas: ¿hay motivo… [+4251 chars]"
HuffPost,Caroline Bologna,Jennifer Lopez’s New Movie Is The Top Film On Netflix Right Now,A 1995 crime classic and new Indian legal drama are also trending on the streaming service.,https://www.huffpost.com/entry/the-mother-popular-netflix-movies_l_6461928ce4b018d846bea44b,2023-05-15T14:09:43Z,"The Mother is the most popular movie on Netflix, according to the streaming services public ranking system.
Released on May 12 to mixed reviews, the film stars Jennifer Lopez as a military asset and… [+1302 chars]"
Polygon,Zosha Millman,"Netflix’s Black Mirror, Star Trek, and all the new TV to watch this week","The best new TV shows to watch at home this week, including Black Mirror on Netflix, a new season of Star Trek, It’s Always Sunny in Philadelphia, and more.",https://www.polygon.com/2023/6/12/23747334/new-tv-series-shows-watch-netflix-black-mirror-star-trek-strange-new-worlds-project-runway,2023-06-12T13:00:00Z,"This week in TV, whats old is new again and honestly, were better for it. 
First of all, Star Trek: Strange New Worlds is back! Its technically a place weve very much gone before (its the shows seco… [+3971 chars]"
Polygon,Austen Goslin,The 5 best horror movies to watch on Netflix and other streamers this May,"Looking for a spooky good time in May? Watch these five scary horror movies on Netflix and other streaming sites now, the best the streaming services have to offer this month.",https://www.polygon.com/what-to-watch/2023/5/25/23734586/best-horror-movies-netflix-streaming-watch-may-2023,2023-05-25T20:00:00Z,"Another month, another round of the best horror movies available on streaming. We may be staring down the barrel of summer, but theres still tons of spooky and seasonally appropriate films to watch t… [+6290 chars]"
HuffPost,Caroline Bologna,This Sci-fi Drama Is The Most Popular Show On Netflix Right Now,A steamy Colombian drama and queer dating reality series are also trending on the streaming service.,https://www.huffpost.com/entry/manifest-popular-netflix-shows_l_647ce92fe4b091b09c334122,2023-06-05T14:09:14Z,"Manifest is currently the most popular show on Netflix, according to the streaming services public ranking system.
Originally an NBC series, the sci-fi drama about a plane that disappears for five y… [+1085 chars]"
MarketWatch,Weston Blasi,: Barack Obama says being president was a ‘hoot’ 70% of the time — but here’s what he didn’t like,"The former president, whose new Netflix docuseries ‘Working: What We Do All Day’ just dropped on Netflix, shared his own work stories during a recent live event",https://www.marketwatch.com/story/barack-obama-says-being-president-was-a-hoot-70-of-the-time-but-heres-what-he-didnt-like-f6b3f37a,2023-05-26T20:21:00Z,"Former President Barack Obama says he loved being president about 70% of the time, as he told journalist Ira Glass during a recent LinkedIn event focused on finding purpose at work. But he didnt enjo… [+2685 chars]"
Android Police,Stephen Schenck,Netflix password sharing is now officially dead,"Crackdown comes to the US, with stupid-expensive extra member offer",https://www.androidpolice.com/netflix-password-sharing-dead/,2023-05-23T19:39:05Z,"Is it too early to harbor feelings of nostalgia for the early days of streaming? We've come a long way from just choosing between Netflix and Hulu, and while branding is always shifting, and players … [+2257 chars]"
Hipertextual,Nolan Rada Galindo,‘Black Mirror’: mira el nuevo tráiler de la sexta temporada y conoce la fecha de estreno,"A finales de abril de 2023, un tuit en el perfil oficial de la serie Black Mirror alertaba sobre que podría haber alguna novedad sobre la producción. Al poco tiempo del mensaje, se tuvo el primer avance de la sexta temporada, una que ahora tiene fecha de estr…",http://hipertextual.com/2023/05/black-mirror-trailer-sexta-temporada-fecha-de-estreno-netflix,2023-05-31T14:58:39Z,"A finales de abril de 2023, un tuit en el perfil oficial de la serie Black Mirror alertaba sobre que podría haber alguna novedad sobre la producción. Al poco tiempo del mensaje, se tuvo el primer ava… [+2811 chars]"
Hipertextual,Miguel Castillo,"Danny Masterson, de ‘That 70s Show’, declarado culpable de violar a dos mujeres. Enfrenta 30 años de cárcel",Danny Masterson enfrenta una sentencia de 30 años de cárcel por violación. El actor es especialmente conocido por su interpretación de Steven Hyde en las ocho temporadas de That '70s Show. También participó en 50 episodios de The Ranch en Netflix. El actor fu…,http://hipertextual.com/2023/06/danny-masterson-that-70s-show-sentenciado-a-30-anos-carcel-violacion,2023-06-01T11:15:42Z,Danny Masterson enfrenta una sentencia de 30 años de cárcel por violación. El actor es especialmente conocido por su interpretación de Steven Hyde en las ocho temporadas de That '70s Show. También pa… [+2870 chars]
Hipertextual,Nolan Rada Galindo,"Este es el nuevo tráiler de ‘Bird Box Barcelona’, con Mario Casas","A principios de mayo de 2023 se conoció el primer avance sobre Bird Box Barcelona, el spin-off de A ciegas, aquella película protagonizada por Sandra Bullock. Hace unos años, ese largometraje fue un éxito dentro de Netflix. Puede que la plataforma, con esta n…",http://hipertextual.com/2023/06/bird-box-barcelona-nuevo-trailer,2023-06-05T15:44:49Z,"A principios de mayo de 2023 se conoció el primer avance sobreBird Box Barcelona, el spin-off de A ciegas, aquella película protagonizada por Sandra Bullock. Hace unos años, ese largometraje fue un é… [+3800 chars]"
Hipertextual,Luis Miranda,Amazon podría añadir anuncios a Prime Video para que pagues más,"Amazon podría unirse a Netflix y Disney al lanzar una suscripción de Prime Video con anuncios. De acuerdo con un reporte del diario The Wall Street Journal, el gigante tecnológico buscaría aumentar los ingresos de la empresa con una opción de su servicio de s…",http://hipertextual.com/2023/06/prime-video-anuncios-plan-amazon,2023-06-07T19:20:00Z,"Amazon podría unirse a Netflix y Disney al lanzar una suscripción de Prime Video con anuncios. De acuerdo con un reporte del diario The Wall Street Journal, el gigante tecnológico buscaría aumentar l… [+3474 chars]"
